{
  "authorization_sha256": "e0a9611bf8b3384660a7674c0a126956cd1ea304635c1896cf045b82f3e05d9d",
  "external_signature": null,
  "generated_at": "2026-09-13T02:33:10Z",
  "manifest_sha256": "bdc02b55280dc3dc50c874f3de3a04691b3fcae9febe92a9386420a4070079b6",
  "release_id": "V16.2.0",
  "release_tree": {
    "algorithm": "sha256-canonical-file-list-v1",
    "file_count": 118,
    "files": [
      {
        "path": "agents/openai.yaml",
        "sha256": "259a882e4f6045e692923c43c8fc7768d996c12d75128e519c9243d910ef199b",
        "size": 315
      },
      {
        "path": "evals/release/release-plan.json",
        "sha256": "6eea7e478ab5ec8f695cb79b123838758dd6dcbf9391a2d0f3cc45eecd922364",
        "size": 12828
      },
      {
        "path": "evals/release/release-state.json",
        "sha256": "abe62e3a6ed61789b657095661101dd4c1e7c89bcd361b8b2e3f4abc483e992b",
        "size": 271
      },
      {
        "path": "evals/v15-regression-cases.json",
        "sha256": "c03d89965f74c421e0a11daa57c5e62a4f86c8bb8a4a78210107f9b3b3fdd150",
        "size": 14338
      },
      {
        "path": "references/artifact-contract.json",
        "sha256": "7fcb3a569887b81a8b07b65dc474c9fab4575f2272df6cfc982f4ed9c7261c3f",
        "size": 3594
      },
      {
        "path": "references/capability-packet-registry.json",
        "sha256": "71d4d0101b3edaf0beacd51ff548e82ccae76177cd37cb7a23ef0c1ccb92d296",
        "size": 8607
      },
      {
        "path": "references/capability-packets/data/identity-and-audit.md",
        "sha256": "945e652dc68f0286056b3314354767ad0010128905af16081bf2684274283648",
        "size": 4731
      },
      {
        "path": "references/capability-packets/data/treatment-and-freeze.md",
        "sha256": "0c6239df194589057b50d11d4db3b513e5a0b0eda0f2c1def697d6a19d3e5bf5",
        "size": 4432
      },
      {
        "path": "references/capability-packets/evidence/final-delivery-and-compliance.md",
        "sha256": "e94709fa0aaea484c3c517b693606220509e3403744fb2980e3189f21bc8b386",
        "size": 5950
      },
      {
        "path": "references/capability-packets/evidence/literature-and-source-evidence.md",
        "sha256": "e880127fb7383a5e614c76a5b99ce176ee47627ebea4a2bc4010129ec95aebf4",
        "size": 11128
      },
      {
        "path": "references/capability-packets/evidence/provenance-and-handoff.md",
        "sha256": "8edc0bee9346fd09ed9c8ba4a543d75b79d06bdc1671a8567c013fac34de3aac",
        "size": 6541
      },
      {
        "path": "references/capability-packets/governance/skill-maintenance.md",
        "sha256": "385a320b958b23133274db5f6dbf717a0c894b5d28a9f3f948eecb31e9dc3be3",
        "size": 14362
      },
      {
        "path": "references/capability-packets/manuscript/expression-and-argument.md",
        "sha256": "b8695acf2eb141d1580f924f2d4ac375417270aee1e8cacc3a0b1ab7ebf81a61",
        "size": 17301
      },
      {
        "path": "references/capability-packets/manuscript/latex-and-finalization.md",
        "sha256": "8d57029220042193ec267ef6fcc5f3791722deaff7b402d4f19ec82897d0defa",
        "size": 15820
      },
      {
        "path": "references/capability-packets/manuscript/reader-audit-and-local-edit.md",
        "sha256": "d38ef4b3c28777fd77f4143171d29c9ffaff54335b0b31fe43fa90c362186511",
        "size": 12880
      },
      {
        "path": "references/capability-packets/manuscript/structure-and-section-contracts.md",
        "sha256": "510265d8ec0f7ad8f4bda0d9a81534ef6dc944ee1b71fe78d0c1063c20401c6d",
        "size": 14535
      },
      {
        "path": "references/capability-packets/modeling/implementation-solving-and-results.md",
        "sha256": "d78aa047df03eda7c683578fba9d302d49d2dc36938ba2d3f08b00c4598e40c6",
        "size": 17004
      },
      {
        "path": "references/capability-packets/modeling/mathematical-specification.md",
        "sha256": "98a24509e9ffba54e35b5eaf3fd3e821844ece0906da604972e9ca23736ac057",
        "size": 8141
      },
      {
        "path": "references/capability-packets/modeling/problem-and-candidates.md",
        "sha256": "e88d1be44ec5a85dd471ba9444ef28fe928fc77a2964ac0275dba59c54eb6a07",
        "size": 8475
      },
      {
        "path": "references/capability-packets/project/platform-and-artifacts.md",
        "sha256": "90b3b7c63123bd9d9035ddfac508bdb7e83bb090460533b8b6ca10f1f42e7baa",
        "size": 16159
      },
      {
        "path": "references/capability-packets/project/recovery-and-handoff.md",
        "sha256": "624ffcb72a4210274fc73f7e18f18cf4fb19e57ab018e9f142511c171005f4a2",
        "size": 16674
      },
      {
        "path": "references/capability-packets/project/scope-and-plan.md",
        "sha256": "905e3026993195a959e7721083a7f07a9f1be60d9a47238999357e4efa1c3ace",
        "size": 9964
      },
      {
        "path": "references/capability-packets/verification/implementation-axis.md",
        "sha256": "d793ed09f6f26f93aae0a737fc29aaf9cd630c58f0bf349d21b7306721b0e70a",
        "size": 6549
      },
      {
        "path": "references/capability-packets/verification/model-axis.md",
        "sha256": "3702db75f3f7830156444631613730ae719d8b376efcf41a187c48f1961e32a0",
        "size": 5408
      },
      {
        "path": "references/capability-packets/verification/uncertainty-and-robustness.md",
        "sha256": "7dab2a045a50c5536c8730b60e179ba62d15c024f73a15c583930a763d7a0c59",
        "size": 6000
      },
      {
        "path": "references/capability-packets/visual/figure-brief-and-data-charts.md",
        "sha256": "1c2dffbb71a193d93c963400f5a1d77b5f0b8cf1c68efbb81ca8012329ab3e63",
        "size": 8163
      },
      {
        "path": "references/capability-packets/visual/render-and-audit.md",
        "sha256": "1afd5d99c98b71253b58ad5a99776fe46feade8c91fb5e3115cc17156ed2d4cd",
        "size": 8127
      },
      {
        "path": "references/capability-packets/visual/scientific-schematics.md",
        "sha256": "ecefad6230ce7eed94f62ae275117ca19521f55ed62f3e7087e7de35ac186c7e",
        "size": 6782
      },
      {
        "path": "references/compatible-change-bundle.schema.json",
        "sha256": "62f108d1bb8606d6e4a151a96d766e6d6590ee1c0a5312b331476b31f32c011a",
        "size": 1969
      },
      {
        "path": "references/data-method-notes.md",
        "sha256": "6f09b17ecd48eaebbf9544499e2e66e0eb28b9bc332182a16f3838623ab49545",
        "size": 2414
      },
      {
        "path": "references/effect-target-registry.json",
        "sha256": "f110897ebdf6fe6c9a628a0878e704577fe1043e91b14ac300e5d1719ff2b869",
        "size": 40133
      },
      {
        "path": "references/evidence-method-notes.md",
        "sha256": "8b07abd1bbe6cc6c33ca5b6c9ce3af2fbd9750a05000d89957f7d7417555663d",
        "size": 1424
      },
      {
        "path": "references/maintenance-method-notes.md",
        "sha256": "f8cc9c13e6314ff40ddda41d907104e4e2cad7f1a8ab04e5ba3eb70526e3bf7a",
        "size": 804
      },
      {
        "path": "references/manuscript-change-closure.json",
        "sha256": "f15feba3ef4a9ae91a26f32a03cdc773bf499217537999c3c8e58059d9d19b46",
        "size": 28487
      },
      {
        "path": "references/manuscript-method-notes.md",
        "sha256": "b67abffbd90345824b69b5623f7cebb2578f64353848dec7d45b1eaf5de1b1bb",
        "size": 2782
      },
      {
        "path": "references/migration/capability-crosswalk.json",
        "sha256": "61c748c48d532afe9b914ad85ccdc782144931347aa650b3fb4bb07f21a94c94",
        "size": 275288
      },
      {
        "path": "references/migration/clause-preservation.json",
        "sha256": "3adbff68e30c5a3ad8e51bdc3edcb5c9d43cca66096a3f23ae166fc642a3b58a",
        "size": 408661
      },
      {
        "path": "references/migration/legacy-coverage.json",
        "sha256": "3b0b195d6244402343cf402a2a6b0b21cfa9750fdaf1769d14c829852a96a748",
        "size": 519136
      },
      {
        "path": "references/migration/native-capabilities.json",
        "sha256": "c160257539667dd727bd19653599de17c9343f7d3d6cd9185ebe6eab17873ce6",
        "size": 3658
      },
      {
        "path": "references/migration/platform-restoration.json",
        "sha256": "815268d49eecb9aed275ca256d9b835de6501fbb483b365d18830fa087be4597",
        "size": 2755
      },
      {
        "path": "references/migration/v1-v9-capability-ledger.json",
        "sha256": "c44427ba0829e71d37c4f6f6012c35760e70647b0022fee6b239190fab13166e",
        "size": 2468438
      },
      {
        "path": "references/migration/v15-preservation-ledger.json",
        "sha256": "7fdaf19541e967807c0ce4910ba77a30757a31faea75daf5b5f188d2f460e75c",
        "size": 9190
      },
      {
        "path": "references/migration/v9-capability-baseline.json",
        "sha256": "e76f1fc34e86ac8b2db86a6089b4de3aa5181f0f203102fcf816ce01ee1533f1",
        "size": 23136
      },
      {
        "path": "references/modeling-method-notes.md",
        "sha256": "7ce1c1f6c1b00d29e61557d958a7f0d05fb77f77c5f06cd264d830d96c6ec5a3",
        "size": 2828
      },
      {
        "path": "references/ownership-contract.json",
        "sha256": "f4ec7406b2e5b53da2e83f7922ac563b754a135e9f86460e83d4f0d9ee834004",
        "size": 7936
      },
      {
        "path": "references/preservation/audit-v1-v5.md",
        "sha256": "7a62d0330151a852ced85291e1febd72e011bc004ec22a438ddc373f9956f352",
        "size": 64216
      },
      {
        "path": "references/preservation/audit-v11-v14.md",
        "sha256": "17bc68dd696e1a44bc0a8940affabe76791538aab04fcefa19d74bc3d15e0be7",
        "size": 33916
      },
      {
        "path": "references/preservation/audit-v6-v10.md",
        "sha256": "919f59147e96552e3879fd7249f1e1442baba9cd05f21e18b2a65ab0d22538ec",